[
  {
    "id": "redis",
    "label": "Redis 原理",
    "module": "redis",
    "type": "module",
    "href": "redis/index.html",
    "desc": "内存数据结构、持久化、淘汰策略、集群和分布式锁。"
  },
  {
    "id": "redis-types",
    "label": "Redis 数据类型",
    "module": "redis",
    "type": "page",
    "href": "redis/data-types.html",
    "desc": "String/List/Hash/Set/ZSet 与 listpack、quicklist、skiplist。",
    "kind": "mechanism",
    "level": "intermediate",
    "presentations": [
      "diagram",
      "animation",
      "code"
    ],
    "interaction": "stepper",
    "learning": {
      "objective": "理解Redis 数据类型的核心原理、适用场景与工程边界。"
    }
  },
  {
    "id": "redis-persistence",
    "label": "Redis 持久化",
    "module": "redis",
    "type": "page",
    "href": "redis/persistence.html",
    "desc": "RDB、AOF、rewrite 与 fsync 策略，和 WAL、Page Cache、顺序写相关。",
    "kind": "mechanism",
    "level": "intermediate",
    "presentations": [
      "article",
      "diagram",
      "animation",
      "lab"
    ],
    "interaction": "stepper",
    "learning": {
      "objective": "理解Redis 持久化的核心原理、适用场景与工程边界。"
    }
  },
  {
    "id": "redis-eviction",
    "label": "Redis 淘汰策略",
    "module": "redis",
    "type": "page",
    "href": "redis/eviction.html",
    "desc": "LRU、LFU、TTL 与内存上限控制。",
    "kind": "mechanism",
    "level": "intermediate",
    "presentations": [
      "article",
      "diagram",
      "animation",
      "lab"
    ],
    "interaction": "stepper",
    "learning": {
      "objective": "理解Redis 淘汰策略的核心原理、适用场景与工程边界。"
    }
  },
  {
    "id": "redis-cluster",
    "label": "Redis Cluster",
    "module": "redis",
    "type": "page",
    "href": "redis/cluster.html",
    "desc": "槽位分片、主从复制和故障转移，和一致性、网络分区、客户端路由相关。",
    "kind": "mechanism",
    "level": "intermediate",
    "presentations": [
      "article",
      "diagram",
      "animation",
      "lab"
    ],
    "interaction": "stepper",
    "learning": {
      "objective": "理解Redis Cluster的核心原理、适用场景与工程边界。"
    }
  },
  {
    "id": "redis-lock",
    "label": "Redis 分布式锁",
    "module": "redis",
    "type": "page",
    "href": "redis/distributed-lock.html",
    "desc": "SET NX PX、Lua 条件释放、Redlock 的时间假设，以及用 fencing token 保护关键下游。",
    "kind": "mechanism",
    "level": "intermediate",
    "presentations": [
      "article",
      "diagram",
      "animation",
      "lab"
    ],
    "interaction": "stepper",
    "learning": {
      "objective": "理解Redis 分布式锁的核心原理、适用场景与工程边界。"
    }
  },
  {
    "id": "lru-lfu",
    "label": "LRU / LFU",
    "module": "redis",
    "type": "page",
    "href": "redis/lru-lfu.html",
    "desc": "缓存淘汰算法，连接 Redis 淘汰策略、数据库 Buffer Pool 和多级缓存设计。",
    "kind": "mechanism",
    "level": "intermediate",
    "presentations": [
      "article",
      "code"
    ],
    "interaction": "none",
    "learning": {
      "objective": "理解LRU / LFU的核心原理、适用场景与工程边界。"
    }
  },
  {
    "id": "redis-stream",
    "label": "Redis Stream",
    "module": "redis",
    "type": "page",
    "href": "redis/redis-stream.html",
    "desc": "Stream 日志带+ConsumerGroup 游标+PEL 确认列表，带消费者组和 ACK 的消息流结构。",
    "kind": "mechanism",
    "level": "intermediate",
    "presentations": [
      "article",
      "diagram",
      "animation",
      "lab"
    ],
    "interaction": "stepper",
    "learning": {
      "objective": "理解Redis Stream的核心原理、适用场景与工程边界。"
    }
  },
  {
    "id": "redis-pipeline",
    "label": "Redis Pipeline",
    "module": "redis",
    "type": "page",
    "href": "redis/pipeline.html",
    "desc": "批量命令消除 RTT 等待，时间线对比展示 Pipeline 灰色等待段大幅缩短。",
    "kind": "mechanism",
    "level": "intermediate",
    "presentations": [
      "article",
      "diagram",
      "animation",
      "lab"
    ],
    "interaction": "stepper",
    "learning": {
      "objective": "理解Redis Pipeline的核心原理、适用场景与工程边界。"
    }
  },
  {
    "id": "redis-pubsub",
    "label": "Pub/Sub",
    "module": "redis",
    "type": "page",
    "href": "redis/pubsub.html",
    "desc": "发布订阅频道模型和模式匹配，与 Stream 消费语义的对比。",
    "kind": "mechanism",
    "level": "intermediate",
    "presentations": [
      "article"
    ],
    "interaction": "none",
    "learning": {
      "objective": "理解Pub/Sub的核心原理、适用场景与工程边界。"
    }
  }
]
