[
  {
    "id": "distributed",
    "label": "分布式系统",
    "module": "distributed",
    "type": "module",
    "href": "distributed/index.html",
    "desc": "CAP、分布式共识、事务模式与一致性哈希等后端架构基础。"
  },
  {
    "id": "consistent-hash",
    "label": "一致性哈希",
    "module": "distributed",
    "type": "page",
    "href": "distributed/consistent-hash.html",
    "desc": "把 key 映射到环上，减少扩缩容时的数据迁移，是缓存、分片、负载均衡的经典算法。",
    "kind": "system",
    "level": "intermediate",
    "presentations": [
      "article",
      "diagram",
      "animation",
      "lab"
    ],
    "interaction": "stepper",
    "learning": {
      "objective": "理解一致性哈希的核心原理、适用场景与工程边界。"
    }
  },
  {
    "id": "dist-consensus",
    "label": "分布式共识与 etcd",
    "module": "distributed",
    "type": "page",
    "href": "distributed/consensus.html",
    "desc": "从多数派、Raft 和 etcd 的工程边界理解分布式共识，并保留 Paxos 作为可选理论动画。",
    "kind": "system",
    "level": "intermediate",
    "presentations": [
      "article",
      "diagram",
      "animation",
      "lab"
    ],
    "interaction": "playground",
    "embeddedDemos": [
      "distributed/raft.html",
      "distributed/paxos.html"
    ],
    "learning": {
      "objective": "理解多数派共识、Raft 与 etcd 的工程关系，并能判断何时需要深入 Paxos。"
    }
  },
  {
    "id": "dist-consistency-tradeoffs",
    "label": "一致性与可用性权衡",
    "module": "distributed",
    "type": "page",
    "href": "distributed/consistency-tradeoffs.html",
    "desc": "从 CAP 的故障约束与 BASE 的设计取向，判断具体操作何时需要一致响应、降级或异步收敛。",
    "kind": "system",
    "level": "intermediate",
    "presentations": [
      "article",
      "diagram",
      "animation",
      "lab"
    ],
    "interaction": "playground",
    "embeddedDemos": [
      "distributed/cap-theorem.html",
      "distributed/base.html"
    ],
    "learning": {
      "objective": "能从业务不变量和网络分区出发选择一致性、可用性与最终收敛策略。"
    }
  },
  {
    "id": "dist-transactions",
    "label": "分布式事务模式",
    "module": "distributed",
    "type": "page",
    "href": "distributed/transactions.html",
    "desc": "从事务边界、一致性、阻塞和补偿成本比较 2PC、Saga 与 3PC，并保留完整协议动画。",
    "kind": "system",
    "level": "intermediate",
    "presentations": [
      "article",
      "diagram",
      "animation",
      "lab"
    ],
    "interaction": "playground",
    "embeddedDemos": [
      "distributed/2pc.html",
      "distributed/saga.html",
      "distributed/3pc.html"
    ],
    "learning": {
      "objective": "能够根据参与方能力、一致性要求和补偿成本选择分布式事务方案。"
    }
  },
  {
    "id": "zookeeper",
    "label": "ZooKeeper",
    "module": "distributed",
    "type": "page",
    "href": "distributed/zookeeper.html",
    "desc": "ZAB 协议驱动的分布式协调服务，提供强一致的 znode 树和 Watch 通知。",
    "kind": "system",
    "level": "intermediate",
    "presentations": [
      "article",
      "diagram",
      "animation",
      "lab"
    ],
    "interaction": "stepper",
    "learning": {
      "objective": "理解ZooKeeper的核心原理、适用场景与工程边界。"
    }
  },
  {
    "id": "gossip",
    "label": "Gossip 协议",
    "module": "distributed",
    "type": "page",
    "href": "distributed/gossip.html",
    "desc": "随机选邻居传播信息，O(log N) 轮覆盖全集群，天然容错的成员状态同步机制。",
    "kind": "system",
    "level": "intermediate",
    "presentations": [
      "article",
      "diagram",
      "animation",
      "lab"
    ],
    "interaction": "stepper",
    "learning": {
      "objective": "理解Gossip 协议的核心原理、适用场景与工程边界。"
    }
  },
  {
    "id": "dist-conflict-convergence",
    "label": "冲突检测与副本收敛",
    "module": "distributed",
    "type": "page",
    "href": "distributed/conflict-convergence.html",
    "desc": "用向量时钟识别并发版本，并理解 CRDT 在明确数据语义下实现确定性收敛的能力与边界。",
    "kind": "system",
    "level": "intermediate",
    "presentations": [
      "article",
      "diagram",
      "animation",
      "lab"
    ],
    "interaction": "playground",
    "embeddedDemos": [
      "distributed/vector-clock.html",
      "distributed/crdt.html"
    ],
    "learning": {
      "objective": "能够区分冲突检测与冲突解决，并判断向量时钟或 CRDT 是否适合当前多副本场景。"
    }
  },
  {
    "id": "dist-service-discovery",
    "label": "服务注册与发现",
    "module": "distributed",
    "type": "page",
    "href": "distributed/service-discovery.html",
    "desc": "心跳驱动的健康检查、Registry 和 Client 本地缓存最终一致性同步。",
    "kind": "system",
    "level": "intermediate",
    "presentations": [
      "article",
      "diagram",
      "animation",
      "lab"
    ],
    "interaction": "stepper",
    "learning": {
      "objective": "理解服务注册与发现的核心原理、适用场景与工程边界。"
    }
  },
  {
    "id": "dist-lease",
    "label": "分布式租约",
    "module": "distributed",
    "type": "page",
    "href": "distributed/lease.html",
    "desc": "TTL 心跳续约保活，到期自动释放，Fencing Token 防脑裂后旧持有者操作资源，惊群效应用随机抖动缓解。",
    "kind": "system",
    "level": "intermediate",
    "presentations": [
      "article",
      "diagram",
      "animation",
      "lab"
    ],
    "interaction": "stepper",
    "learning": {
      "objective": "理解分布式租约的核心原理、适用场景与工程边界。"
    }
  },
  {
    "id": "dist-quorum",
    "label": "Quorum 读写",
    "module": "distributed",
    "type": "page",
    "href": "distributed/quorum.html",
    "desc": "W+R>N 保证读到最新写，读修复异步修复落后副本，W+R=N 时存在脏读风险，Cassandra/DynamoDB 的一致性旋钮。",
    "kind": "system",
    "level": "intermediate",
    "presentations": [
      "article",
      "diagram",
      "animation",
      "lab"
    ],
    "interaction": "stepper",
    "learning": {
      "objective": "理解Quorum 读写的核心原理、适用场景与工程边界。"
    }
  },
  {
    "id": "dist-spanner",
    "label": "Spanner / TrueTime",
    "module": "distributed",
    "type": "page",
    "href": "distributed/spanner.html",
    "desc": "Google Spanner 通过 GPS+原子钟提供有界误差时间戳，commit-wait 等待误差窗口保证外部一致性，Paxos 分组管理分片，支持全球范围强一致事务。",
    "kind": "system",
    "level": "intermediate",
    "presentations": [
      "article",
      "diagram"
    ],
    "interaction": "none",
    "learning": {
      "objective": "理解Spanner / TrueTime的核心原理、适用场景与工程边界。"
    }
  }
]
