[
  {
    "id": "cloud-native",
    "label": "云原生",
    "module": "cloud-native",
    "type": "module",
    "href": "cloud-native/index.html",
    "desc": "Docker 镜像分层、K8s 控制面、Pod 调度、Service 网络和 HPA 弹性伸缩。"
  },
  {
    "id": "cn-docker",
    "label": "Docker 镜像分层",
    "module": "cloud-native",
    "type": "page",
    "href": "cloud-native/docker.html",
    "desc": "每条 Dockerfile 指令生成一层，OverlayFS 叠加只读镜像和可写容器层，CoW 写时复制。",
    "kind": "mechanism",
    "level": "intermediate",
    "presentations": [
      "article",
      "diagram",
      "animation"
    ],
    "interaction": "stepper",
    "learning": {
      "objective": "理解Docker 镜像分层的核心原理、适用场景与工程边界。"
    }
  },
  {
    "id": "cn-kubernetes",
    "label": "K8s 控制面",
    "module": "cloud-native",
    "type": "page",
    "href": "cloud-native/kubernetes.html",
    "desc": "kubectl apply → API Server 认证鉴权 → etcd Raft → Controller Watch → Scheduler → kubelet。",
    "kind": "mechanism",
    "level": "intermediate",
    "presentations": [
      "article",
      "diagram",
      "animation"
    ],
    "interaction": "stepper",
    "learning": {
      "objective": "理解K8s 控制面的核心原理、适用场景与工程边界。"
    }
  },
  {
    "id": "cn-scheduling",
    "label": "Pod 调度",
    "module": "cloud-native",
    "type": "page",
    "href": "cloud-native/k8s-scheduling.html",
    "desc": "Filter 淘汰不满足节点（资源/Taint），Score 多插件加权打分，最优节点绑定 Pod。",
    "kind": "mechanism",
    "level": "intermediate",
    "presentations": [
      "article",
      "diagram",
      "animation"
    ],
    "interaction": "stepper",
    "learning": {
      "objective": "理解Pod 调度的核心原理、适用场景与工程边界。"
    }
  },
  {
    "id": "cn-networking",
    "label": "Service 网络",
    "module": "cloud-native",
    "type": "page",
    "href": "cloud-native/k8s-networking.html",
    "desc": "ClusterIP 是虚拟 IP，iptables DNAT 规则完成真正的负载均衡转发，VXLAN 跨节点。",
    "kind": "mechanism",
    "level": "intermediate",
    "presentations": [
      "article",
      "diagram",
      "animation"
    ],
    "interaction": "stepper",
    "learning": {
      "objective": "理解Service 网络的核心原理、适用场景与工程边界。"
    }
  },
  {
    "id": "cn-hpa",
    "label": "HPA 弹性伸缩",
    "module": "cloud-native",
    "type": "page",
    "href": "cloud-native/k8s-hpa.html",
    "desc": "metrics-server 提供 CPU 指标，HPA 公式计算目标副本数，冷却期防频繁伸缩。",
    "kind": "mechanism",
    "level": "intermediate",
    "presentations": [
      "article",
      "diagram",
      "animation"
    ],
    "interaction": "stepper",
    "learning": {
      "objective": "理解HPA 弹性伸缩的核心原理、适用场景与工程边界。"
    }
  },
  {
    "id": "cn-serverless",
    "label": "Serverless / FaaS",
    "module": "cloud-native",
    "type": "page",
    "href": "cloud-native/serverless.html",
    "desc": "函数即服务：冷启动分段耗时、scale-to-zero 零成本空闲、并发扩容、事件驱动触发与幂等设计。",
    "kind": "mechanism",
    "level": "intermediate",
    "presentations": [
      "article",
      "diagram",
      "animation"
    ],
    "interaction": "stepper",
    "learning": {
      "objective": "理解Serverless / FaaS的核心原理、适用场景与工程边界。"
    }
  },
  {
    "id": "cn-gitops",
    "label": "GitOps / ArgoCD",
    "module": "cloud-native",
    "type": "page",
    "href": "cloud-native/gitops.html",
    "desc": "以 Git 为唯一事实来源，ArgoCD 持续对比 Git 与集群状态，检测 drift 后自动将集群拉回声明状态，可审计可回溯。",
    "kind": "mechanism",
    "level": "intermediate",
    "presentations": [
      "article",
      "diagram",
      "animation"
    ],
    "interaction": "stepper",
    "learning": {
      "objective": "理解GitOps / ArgoCD的核心原理、适用场景与工程边界。"
    }
  },
  {
    "id": "cn-service-mesh",
    "label": "Service Mesh",
    "module": "cloud-native",
    "type": "page",
    "href": "cloud-native/service-mesh.html",
    "desc": "Sidecar 代理（Envoy）拦截所有流量，Istiod 通过 xDS 下发路由/限流/熔断/mTLS 策略，业务代码零改动实现服务治理。",
    "kind": "mechanism",
    "level": "intermediate",
    "presentations": [
      "article",
      "diagram",
      "animation"
    ],
    "interaction": "stepper",
    "learning": {
      "objective": "理解Service Mesh的核心原理、适用场景与工程边界。"
    }
  },
  {
    "id": "cn-helm",
    "label": "Helm 包管理",
    "module": "cloud-native",
    "type": "page",
    "href": "cloud-native/helm.html",
    "desc": "K8s 包管理器，Chart 打包多个 Manifest，values.yaml 参数化多环境差异，支持版本控制和一键回滚。",
    "kind": "mechanism",
    "level": "intermediate",
    "presentations": [
      "article"
    ],
    "interaction": "none",
    "learning": {
      "objective": "理解Helm 包管理的核心原理、适用场景与工程边界。"
    }
  },
  {
    "id": "cn-operator",
    "label": "Kubernetes Operator",
    "module": "cloud-native",
    "type": "page",
    "href": "cloud-native/operator.html",
    "desc": "CRD 描述期望状态，自定义 Controller Reconcile 循环持续将实际状态拉向期望，让 K8s 能管理有状态应用。",
    "kind": "mechanism",
    "level": "intermediate",
    "presentations": [
      "article",
      "diagram",
      "animation"
    ],
    "interaction": "stepper",
    "learning": {
      "objective": "理解Kubernetes Operator的核心原理、适用场景与工程边界。"
    }
  },
  {
    "id": "cn-storage",
    "label": "K8s 存储 PV/PVC",
    "module": "cloud-native",
    "type": "page",
    "href": "cloud-native/k8s-storage.html",
    "desc": "StorageClass → CSI Driver 动态创建 PV，PVC 申请绑定，Pod 重调度时数据持久保留，支持在线扩容。",
    "kind": "mechanism",
    "level": "intermediate",
    "presentations": [
      "article",
      "diagram",
      "animation"
    ],
    "interaction": "stepper",
    "learning": {
      "objective": "理解K8s 存储 PV/PVC的核心原理、适用场景与工程边界。"
    }
  }
]
