[
  {
    "id": "observability",
    "label": "可观测性",
    "module": "observability",
    "type": "module",
    "href": "observability/index.html",
    "desc": "Prometheus 指标采集、OpenTelemetry 链路追踪和 SLO Error Budget 管理三大支柱。"
  },
  {
    "id": "obs-prometheus",
    "label": "Prometheus",
    "module": "observability",
    "type": "page",
    "href": "observability/prometheus.html",
    "desc": "拉取模式 Scrape 每 15s、TSDB 内存块压缩到磁盘和 Alertmanager 规则持续评估。",
    "kind": "mechanism",
    "level": "intermediate",
    "presentations": [
      "article",
      "diagram",
      "animation",
      "lab"
    ],
    "interaction": "stepper",
    "learning": {
      "objective": "理解Prometheus的核心原理、适用场景与工程边界。"
    }
  },
  {
    "id": "obs-tracing-platform",
    "label": "分布式追踪与 OpenTelemetry",
    "module": "observability",
    "type": "page",
    "href": "observability/tracing-platform.html",
    "desc": "统一理解 Trace、Span、上下文传播、OpenTelemetry SDK、Collector、采样和后端存储。",
    "kind": "mechanism",
    "level": "intermediate",
    "presentations": [
      "article",
      "diagram",
      "animation",
      "lab"
    ],
    "interaction": "playground",
    "embeddedDemos": [
      "observability/opentelemetry.html",
      "observability/tracing.html",
      "distributed/distributed-tracing.html"
    ],
    "learning": {
      "objective": "能够设计跨服务上下文传播、采集、采样和追踪数据管道。"
    }
  },
  {
    "id": "obs-slo",
    "label": "SLO & Error Budget",
    "module": "observability",
    "type": "page",
    "href": "observability/slo.html",
    "desc": "SLO 目标定义月故障预算，Error Budget 耗尽冻结发布，Burn Rate 预警。",
    "kind": "mechanism",
    "level": "intermediate",
    "presentations": [
      "article",
      "diagram",
      "animation",
      "lab"
    ],
    "interaction": "stepper",
    "learning": {
      "objective": "理解SLO & Error Budget的核心原理、适用场景与工程边界。"
    }
  },
  {
    "id": "obs-logging",
    "label": "日志体系 ELK/Loki",
    "module": "observability",
    "type": "page",
    "href": "observability/logging.html",
    "desc": "Fluentd/Promtail 采集 → Elasticsearch/Loki 存储，倒排索引全文检索，Agent 崩溃从 checkpoint 续传不丢日志。",
    "kind": "mechanism",
    "level": "intermediate",
    "presentations": [
      "article",
      "diagram",
      "animation",
      "lab"
    ],
    "interaction": "stepper",
    "learning": {
      "objective": "理解日志体系 ELK/Loki的核心原理、适用场景与工程边界。"
    }
  },
  {
    "id": "obs-grafana",
    "label": "Grafana 与告警",
    "module": "observability",
    "type": "page",
    "href": "observability/grafana.html",
    "desc": "Dashboard 分层设计（USE/RED 方法），Alertmanager 路由/分组/抑制/静默，告警信噪比与 SLO 联动设计。",
    "kind": "mechanism",
    "level": "intermediate",
    "presentations": [
      "article",
      "code"
    ],
    "interaction": "none",
    "learning": {
      "objective": "理解Grafana 与告警的核心原理、适用场景与工程边界。"
    }
  },
  {
    "id": "obs-chaos",
    "label": "混沌工程",
    "module": "observability",
    "type": "page",
    "href": "observability/chaos.html",
    "desc": "稳态假说 → 注入故障 → 观测偏差 → 修复薄弱点，Chaos Mesh/Monkey 实现 Pod Kill/网络分区/延迟注入。",
    "kind": "mechanism",
    "level": "intermediate",
    "presentations": [
      "article",
      "diagram",
      "animation",
      "lab"
    ],
    "interaction": "stepper",
    "learning": {
      "objective": "理解混沌工程的核心原理、适用场景与工程边界。"
    }
  }
]
