[
  {
    "id": "system-design",
    "label": "系统设计",
    "module": "system-design",
    "type": "module",
    "href": "system-design/index.html",
    "desc": "短链、限流、分布式 ID、消息推送、秒杀——把算法和中间件组装成真实系统。"
  },
  {
    "id": "sd-short-url",
    "label": "短链系统",
    "module": "system-design",
    "type": "page",
    "href": "system-design/short-url.html",
    "desc": "URL 哈希、Base62 编码、数据库持久化、Redis 缓存和 302 重定向的完整链路。",
    "kind": "system",
    "level": "intermediate",
    "presentations": [
      "article",
      "diagram",
      "animation"
    ],
    "interaction": "stepper",
    "learning": {
      "objective": "理解短链系统的核心原理、适用场景与工程边界。"
    }
  },
  {
    "id": "sd-rate-limiter",
    "label": "限流器",
    "module": "system-design",
    "type": "page",
    "href": "system-design/rate-limiter.html",
    "desc": "令牌桶、滑动窗口、分布式限流（Redis Lua）和多级降级策略。",
    "kind": "system",
    "level": "intermediate",
    "presentations": [
      "article",
      "diagram",
      "animation"
    ],
    "interaction": "stepper",
    "learning": {
      "objective": "理解限流器的核心原理、适用场景与工程边界。"
    }
  },
  {
    "id": "sd-distributed-id",
    "label": "分布式 ID",
    "module": "system-design",
    "type": "page",
    "href": "system-design/distributed-id.html",
    "desc": "Snowflake 位布局、时钟回拨处理、Leaf 号段模式和多机分配。",
    "kind": "system",
    "level": "intermediate",
    "presentations": [
      "article",
      "diagram",
      "animation"
    ],
    "interaction": "stepper",
    "learning": {
      "objective": "理解分布式 ID的核心原理、适用场景与工程边界。"
    }
  },
  {
    "id": "sd-push-system",
    "label": "消息推送系统",
    "module": "system-design",
    "type": "page",
    "href": "system-design/push-system.html",
    "desc": "长连接管理、Kafka 消息分发、扇出写/扇出读、ACK 和重试机制。",
    "kind": "system",
    "level": "intermediate",
    "presentations": [
      "article",
      "diagram",
      "animation"
    ],
    "interaction": "stepper",
    "learning": {
      "objective": "理解消息推送系统的核心原理、适用场景与工程边界。"
    }
  },
  {
    "id": "sd-flash-sale",
    "label": "秒杀系统",
    "module": "system-design",
    "type": "page",
    "href": "system-design/flash-sale.html",
    "desc": "流量漏斗、Redis 预扣库存、Kafka 异步下单、降级兜底和数据一致性。",
    "kind": "system",
    "level": "intermediate",
    "presentations": [
      "article",
      "diagram",
      "animation"
    ],
    "interaction": "stepper",
    "learning": {
      "objective": "理解秒杀系统的核心原理、适用场景与工程边界。"
    }
  },
  {
    "id": "sd-feed-system",
    "label": "信息流系统",
    "module": "system-design",
    "type": "page",
    "href": "system-design/feed-system.html",
    "desc": "推模式/拉模式/混合扇出策略，用 Redis sorted set 和 Kafka 构建低延迟 Timeline。",
    "kind": "system",
    "level": "intermediate",
    "presentations": [
      "article",
      "diagram",
      "animation",
      "lab"
    ],
    "interaction": "stepper",
    "learning": {
      "objective": "理解信息流系统的核心原理、适用场景与工程边界。"
    }
  },
  {
    "id": "sd-chat-system",
    "label": "即时通讯系统",
    "module": "system-design",
    "type": "page",
    "href": "system-design/chat-system.html",
    "desc": "WebSocket 长连接管理、消息顺序 ID、收件箱和离线推送的完整 IM 架构。",
    "kind": "system",
    "level": "intermediate",
    "presentations": [
      "article",
      "diagram",
      "animation",
      "lab"
    ],
    "interaction": "stepper",
    "learning": {
      "objective": "理解即时通讯系统的核心原理、适用场景与工程边界。"
    }
  },
  {
    "id": "sd-search-platform",
    "label": "搜索平台架构",
    "module": "system-design",
    "type": "page",
    "href": "system-design/search-platform.html",
    "desc": "统一搜索引擎的索引、召回、排序与自动补全低延迟链路，并保留两套架构动画。",
    "kind": "system",
    "level": "intermediate",
    "presentations": [
      "article",
      "diagram",
      "animation",
      "lab"
    ],
    "interaction": "playground",
    "embeddedDemos": [
      "system-design/search-engine.html",
      "system-design/search-suggest.html"
    ],
    "learning": {
      "objective": "理解搜索平台的离线索引、在线检索、搜索建议与质量指标。"
    }
  },
  {
    "id": "sd-object-storage",
    "label": "对象存储",
    "module": "system-design",
    "type": "page",
    "href": "system-design/object-storage.html",
    "desc": "分块上传、纠删码副本、元数据分离和 GC 机制，是 S3/OSS 的核心设计模式。",
    "kind": "system",
    "level": "intermediate",
    "presentations": [
      "article",
      "diagram",
      "animation",
      "lab"
    ],
    "interaction": "stepper",
    "learning": {
      "objective": "理解对象存储的核心原理、适用场景与工程边界。"
    }
  },
  {
    "id": "sd-task-scheduler",
    "label": "分布式任务调度",
    "module": "system-design",
    "type": "page",
    "href": "system-design/task-scheduler.html",
    "desc": "时间轮 O(1) 触发、分布式分片和幂等执行，保证任务准时不重复地执行。",
    "kind": "system",
    "level": "intermediate",
    "presentations": [
      "article",
      "diagram",
      "animation",
      "lab"
    ],
    "interaction": "stepper",
    "learning": {
      "objective": "理解分布式任务调度的核心原理、适用场景与工程边界。"
    }
  },
  {
    "id": "sd-geo-service",
    "label": "地理位置服务",
    "module": "system-design",
    "type": "page",
    "href": "system-design/geo-service.html",
    "desc": "GeoHash 将经纬度编码为可索引字符串，四叉树支持非均匀 POI 分布的范围查询。",
    "kind": "system",
    "level": "intermediate",
    "presentations": [
      "article",
      "diagram",
      "animation",
      "lab"
    ],
    "interaction": "stepper",
    "learning": {
      "objective": "理解地理位置服务的核心原理、适用场景与工程边界。"
    }
  },
  {
    "id": "sd-api-gateway",
    "label": "API Gateway",
    "module": "system-design",
    "type": "page",
    "href": "system-design/api-gateway.html",
    "desc": "认证/限流/路由/熔断串联，每个策略有独立内部状态，请求球逐层通过。",
    "kind": "system",
    "level": "intermediate",
    "presentations": [
      "article",
      "diagram",
      "animation",
      "lab"
    ],
    "interaction": "stepper",
    "learning": {
      "objective": "理解API Gateway的核心原理、适用场景与工程边界。"
    }
  },
  {
    "id": "sd-notification",
    "label": "通知系统",
    "module": "system-design",
    "type": "page",
    "href": "system-design/notification-system.html",
    "desc": "优先级队列多渠道并行、失败重试倒计时和幂等 key 防重复投递。",
    "kind": "system",
    "level": "intermediate",
    "presentations": [
      "article",
      "diagram",
      "animation",
      "lab"
    ],
    "interaction": "stepper",
    "learning": {
      "objective": "理解通知系统的核心原理、适用场景与工程边界。"
    }
  },
  {
    "id": "sd-webcrawler",
    "label": "网络爬虫",
    "module": "system-design",
    "type": "page",
    "href": "system-design/web-crawler.html",
    "desc": "BFS 向外扩展 URL、Bloom Filter 位数组判重和 robots.txt 过滤。",
    "kind": "system",
    "level": "intermediate",
    "presentations": [
      "article",
      "diagram",
      "animation",
      "lab"
    ],
    "interaction": "stepper",
    "learning": {
      "objective": "理解网络爬虫的核心原理、适用场景与工程边界。"
    }
  },
  {
    "id": "sd-media-platform",
    "label": "视频与直播平台架构",
    "module": "system-design",
    "type": "page",
    "href": "system-design/media-platform.html",
    "desc": "统一比较点播与直播的采集、转码、切片、CDN、弱网和低延迟架构，并保留两套动画。",
    "kind": "system",
    "level": "intermediate",
    "presentations": [
      "article",
      "diagram",
      "animation",
      "lab"
    ],
    "interaction": "playground",
    "embeddedDemos": [
      "system-design/video-streaming.html",
      "system-design/live-streaming.html"
    ],
    "learning": {
      "objective": "能够根据点播或直播、延迟、并发和成本约束设计音视频平台。"
    }
  },
  {
    "id": "sd-payment",
    "label": "支付系统",
    "module": "system-design",
    "type": "page",
    "href": "system-design/payment-system.html",
    "desc": "两阶段预扣确认状态机、幂等键防重复支付和对账任务补偿回滚。",
    "kind": "system",
    "level": "intermediate",
    "presentations": [
      "article",
      "diagram",
      "animation",
      "lab"
    ],
    "interaction": "stepper",
    "learning": {
      "objective": "理解支付系统的核心原理、适用场景与工程边界。"
    }
  },
  {
    "id": "sd-monitoring",
    "label": "监控系统",
    "module": "system-design",
    "type": "page",
    "href": "system-design/metrics-monitoring.html",
    "desc": "TSDB 时序列存块、Alertmanager 聚合抑制和多维指标采集流水线。",
    "kind": "system",
    "level": "intermediate",
    "presentations": [
      "article",
      "diagram",
      "animation",
      "lab"
    ],
    "interaction": "stepper",
    "learning": {
      "objective": "理解监控系统的核心原理、适用场景与工程边界。"
    }
  },
  {
    "id": "sd-config-center",
    "label": "配置中心",
    "module": "system-design",
    "type": "page",
    "href": "system-design/config-center.html",
    "desc": "集中管理配置，Long Poll 推送变更，服务热更新不重启，灰度推送按实例分批，宕机时降级读本地缓存。",
    "kind": "system",
    "level": "intermediate",
    "presentations": [
      "article",
      "diagram",
      "animation"
    ],
    "interaction": "stepper",
    "learning": {
      "objective": "理解配置中心的核心原理、适用场景与工程边界。"
    }
  },
  {
    "id": "sd-multi-region",
    "label": "多活与异地容灾",
    "module": "system-design",
    "type": "page",
    "href": "system-design/multi-region.html",
    "desc": "GSLB 就近路由双 Region，CDC 跨区同步存在延迟窗口，故障切换保 RTO/RPO 指标，仲裁节点防脑裂。",
    "kind": "system",
    "level": "intermediate",
    "presentations": [
      "article",
      "diagram",
      "animation"
    ],
    "interaction": "stepper",
    "learning": {
      "objective": "理解多活与异地容灾的核心原理、适用场景与工程边界。"
    }
  },
  {
    "id": "sd-recommendation",
    "label": "推荐系统",
    "module": "system-design",
    "type": "page",
    "href": "system-design/recommendation.html",
    "desc": "协同过滤/双塔向量召回生成候选集，轻量粗排过滤，精排 DNN 打分，Rerank 多样性调整，实时用户行为特征更新驱动推荐效果迭代。",
    "kind": "system",
    "level": "intermediate",
    "presentations": [
      "article",
      "diagram",
      "animation"
    ],
    "interaction": "stepper",
    "learning": {
      "objective": "理解推荐系统的核心原理、适用场景与工程边界。"
    }
  }
]
