[
  {
    "id": "cs",
    "label": "计算机组成原理",
    "module": "cs",
    "type": "module",
    "href": "cs/index.html",
    "desc": "CPU、指令、流水线、缓存层次、内存寻址和 I/O 总线。"
  },
  {
    "id": "cpu-pipeline",
    "label": "CPU 指令 / 流水线",
    "module": "cs",
    "type": "page",
    "href": "cs/cpu.html",
    "desc": "取指、译码、执行、流水线、分支预测和乱序执行。",
    "kind": "mechanism",
    "level": "intermediate",
    "presentations": [
      "animation",
      "code"
    ],
    "interaction": "simulator",
    "learning": {
      "objective": "理解CPU 指令 / 流水线的核心原理、适用场景与工程边界。"
    }
  },
  {
    "id": "cache-hierarchy",
    "label": "Cache 层次 / 缓存行",
    "module": "cs",
    "type": "page",
    "href": "cs/cache.html",
    "desc": "L1/L2/L3、缓存行、局部性和 false sharing 的硬件基础。",
    "kind": "mechanism",
    "level": "intermediate",
    "presentations": [
      "animation",
      "code"
    ],
    "interaction": "simulator",
    "learning": {
      "objective": "理解Cache 层次 / 缓存行的核心原理、适用场景与工程边界。"
    }
  },
  {
    "id": "memory-addressing",
    "label": "内存寻址 / TLB",
    "module": "cs",
    "type": "page",
    "href": "cs/memory.html",
    "desc": "虚拟地址、页表、MMU、TLB 和物理内存访问链路。",
    "kind": "mechanism",
    "level": "intermediate",
    "presentations": [
      "animation",
      "code"
    ],
    "interaction": "simulator",
    "learning": {
      "objective": "理解内存寻址 / TLB的核心原理、适用场景与工程边界。"
    }
  },
  {
    "id": "io-bus",
    "label": "总线 / 中断 / DMA",
    "module": "cs",
    "type": "page",
    "href": "cs/io.html",
    "desc": "设备和 CPU 之间通过总线、中断、DMA 进行高效协作。",
    "kind": "mechanism",
    "level": "intermediate",
    "presentations": [
      "animation",
      "code"
    ],
    "interaction": "simulator",
    "learning": {
      "objective": "理解总线 / 中断 / DMA的核心原理、适用场景与工程边界。"
    }
  },
  {
    "id": "number-computing",
    "label": "数字表示与位运算",
    "module": "cs",
    "type": "page",
    "href": "cs/number-computing.html",
    "desc": "统一理解补码、IEEE 754、溢出和精度边界，以及位掩码与状态压缩的工程用法。",
    "kind": "mechanism",
    "level": "intermediate",
    "presentations": [
      "article",
      "animation",
      "comparison",
      "lab"
    ],
    "interaction": "playground",
    "embeddedDemos": [
      "cs/number.html",
      "algo/bit-manipulation.html"
    ],
    "learning": {
      "objective": "理解机器数字表示并能规避整数溢出、浮点精度和位字段演进风险。"
    }
  },
  {
    "id": "cs-barrier",
    "label": "内存屏障",
    "module": "cs",
    "type": "page",
    "href": "cs/barrier.html",
    "desc": "Store/Load barrier、mfence、Go 内存模型的硬件根源。",
    "kind": "mechanism",
    "level": "intermediate",
    "presentations": [
      "animation",
      "code"
    ],
    "interaction": "simulator",
    "learning": {
      "objective": "理解内存屏障的核心原理、适用场景与工程边界。"
    }
  },
  {
    "id": "cs-atomic",
    "label": "原子指令",
    "module": "cs",
    "type": "page",
    "href": "cs/atomic.html",
    "desc": "CAS、LL/SC、x86 LOCK 前缀，sync/atomic 底层实现。",
    "kind": "mechanism",
    "level": "intermediate",
    "presentations": [
      "animation",
      "code"
    ],
    "interaction": "simulator",
    "learning": {
      "objective": "理解原子指令的核心原理、适用场景与工程边界。"
    }
  },
  {
    "id": "cs-branch",
    "label": "分支预测",
    "module": "cs",
    "type": "page",
    "href": "cs/branch-prediction.html",
    "desc": "流水线投机执行、预测失败 flush 代价和两位饱和计数器状态机。",
    "kind": "mechanism",
    "level": "intermediate",
    "presentations": [
      "article",
      "diagram",
      "animation",
      "lab"
    ],
    "interaction": "stepper",
    "learning": {
      "objective": "理解分支预测的核心原理、适用场景与工程边界。"
    }
  },
  {
    "id": "cs-tlb",
    "label": "TLB",
    "module": "cs",
    "type": "page",
    "href": "cs/tlb.html",
    "desc": "虚拟地址拆为 VPN 与页内偏移；TLB 命中避免页表遍历，未命中代价取决于分页层级、页大小与缓存命中。",
    "kind": "mechanism",
    "level": "intermediate",
    "presentations": [
      "article",
      "diagram",
      "animation",
      "lab"
    ],
    "interaction": "stepper",
    "learning": {
      "objective": "理解TLB的核心原理、适用场景与工程边界。"
    }
  },
  {
    "id": "cs-numa",
    "label": "NUMA",
    "module": "cs",
    "type": "page",
    "href": "cs/numa.html",
    "desc": "跨 NUMA 节点访存延迟 2-3x，numactl 绑定优化和 false sharing 隔离。",
    "kind": "mechanism",
    "level": "intermediate",
    "presentations": [
      "article"
    ],
    "interaction": "none",
    "learning": {
      "objective": "理解NUMA的核心原理、适用场景与工程边界。"
    }
  },
  {
    "id": "cs-gpu-arch",
    "label": "GPU 架构",
    "module": "cs",
    "type": "page",
    "href": "cs/gpu-architecture.html",
    "desc": "SM/Warp/SIMT 并行执行模型，显存层次 L1/L2/HBM 带宽差异，Warp 分叉导致效率下降，CPU-GPU 通过 PCIe 协作，是深度学习推理的算力底座。",
    "kind": "mechanism",
    "level": "intermediate",
    "presentations": [
      "article",
      "diagram",
      "animation",
      "lab"
    ],
    "interaction": "stepper",
    "learning": {
      "objective": "理解GPU 架构的核心原理、适用场景与工程边界。"
    }
  }
]
