[
  {
    "id": "testing",
    "label": "测试工程",
    "module": "testing",
    "type": "module",
    "href": "testing/index.html",
    "desc": "从测试金字塔到负载测试、Mock 技术、契约测试和模糊测试，构建系统性的工程质量体系。"
  },
  {
    "id": "test-pyramid",
    "label": "测试金字塔",
    "module": "testing",
    "type": "page",
    "href": "testing/test-pyramid.html",
    "desc": "单元/集成/E2E 三层金字塔策略，测试覆盖率原则，隔离边界划分和分布式系统测试挑战。",
    "kind": "practice",
    "level": "intermediate",
    "presentations": [
      "article"
    ],
    "interaction": "none",
    "learning": {
      "objective": "理解测试金字塔的核心原理、适用场景与工程边界。"
    }
  },
  {
    "id": "test-mock",
    "label": "Mock / Stub / Spy",
    "module": "testing",
    "type": "page",
    "href": "testing/mock-stub.html",
    "desc": "Test Doubles 五种类型对比，接口驱动 Mock 设计，gomock/testify 工程实践和过度 Mock 反模式。",
    "kind": "practice",
    "level": "intermediate",
    "presentations": [
      "article"
    ],
    "interaction": "none",
    "learning": {
      "objective": "理解Mock / Stub / Spy的核心原理、适用场景与工程边界。"
    }
  },
  {
    "id": "test-load",
    "label": "负载与压力测试",
    "module": "testing",
    "type": "page",
    "href": "testing/load-testing.html",
    "desc": "并发用户模型、延迟百分位（P50/P95/P99）、吞吐与延迟权衡，k6/wrk 压测工具和瓶颈识别方法论。",
    "kind": "practice",
    "level": "intermediate",
    "presentations": [
      "article",
      "diagram",
      "animation",
      "lab"
    ],
    "interaction": "stepper",
    "learning": {
      "objective": "理解负载与压力测试的核心原理、适用场景与工程边界。"
    }
  },
  {
    "id": "test-contract",
    "label": "契约测试",
    "module": "testing",
    "type": "page",
    "href": "testing/contract-testing.html",
    "desc": "Consumer-Driven Contract 以消费者期望约束 Provider 接口，Pact 框架实现微服务解耦测试，避免集成环境依赖。",
    "kind": "practice",
    "level": "intermediate",
    "presentations": [
      "article"
    ],
    "interaction": "none",
    "learning": {
      "objective": "理解契约测试的核心原理、适用场景与工程边界。"
    }
  },
  {
    "id": "test-fuzz",
    "label": "模糊测试",
    "module": "testing",
    "type": "page",
    "href": "testing/fuzz-testing.html",
    "desc": "Coverage-guided fuzzing 自动探索边界输入，Go 原生 go test -fuzz 用法，Corpus 语料库管理和工程价值。",
    "kind": "practice",
    "level": "intermediate",
    "presentations": [
      "article"
    ],
    "interaction": "none",
    "learning": {
      "objective": "理解模糊测试的核心原理、适用场景与工程边界。"
    }
  },
  {
    "id": "test-tdd",
    "label": "TDD / BDD",
    "module": "testing",
    "type": "page",
    "href": "testing/tdd.html",
    "desc": "Red-Green-Refactor 循环驱动设计，测试先行减少过度设计，BDD 行为描述连接业务语义和代码实现。",
    "kind": "practice",
    "level": "intermediate",
    "presentations": [
      "article"
    ],
    "interaction": "none",
    "learning": {
      "objective": "理解TDD / BDD的核心原理、适用场景与工程边界。"
    }
  }
]
