[
  {
    "id": "security",
    "label": "安全基础",
    "module": "security",
    "type": "module",
    "href": "security/index.html",
    "desc": "对称非对称加密原理、OAuth 2.0 授权码流程、Web 攻击防御和 JWT 令牌机制。"
  },
  {
    "id": "sec-crypto",
    "label": "对称/非对称加密",
    "module": "security",
    "type": "page",
    "href": "security/crypto.html",
    "desc": "AES-CBC 链式加密和 RSA 加密/签名方向，加密保机密性，签名保真实性。",
    "kind": "protocol",
    "level": "intermediate",
    "presentations": [
      "article",
      "diagram",
      "animation",
      "lab"
    ],
    "interaction": "stepper",
    "learning": {
      "objective": "理解对称/非对称加密的核心原理、适用场景与工程边界。"
    }
  },
  {
    "id": "sec-oauth",
    "label": "OAuth 2.0",
    "module": "security",
    "type": "page",
    "href": "security/oauth.html",
    "desc": "授权码流程四角色，Code 一次性后端渠道换 Token，Access Token 有过期时间。",
    "kind": "protocol",
    "level": "intermediate",
    "presentations": [
      "article",
      "diagram",
      "animation",
      "lab"
    ],
    "interaction": "stepper",
    "learning": {
      "objective": "理解OAuth 2.0的核心原理、适用场景与工程边界。"
    }
  },
  {
    "id": "sec-web-attacks",
    "label": "Web 攻击",
    "module": "security",
    "type": "page",
    "href": "security/web-attacks.html",
    "desc": "SQL 注入代码数据混淆、XSS 输出编码防御和 CSRF SameSite Cookie+Token 双重防御。",
    "kind": "protocol",
    "level": "intermediate",
    "presentations": [
      "article",
      "diagram",
      "animation",
      "lab"
    ],
    "interaction": "stepper",
    "learning": {
      "objective": "理解Web 攻击的核心原理、适用场景与工程边界。"
    }
  },
  {
    "id": "sec-jwt",
    "label": "JWT",
    "module": "security",
    "type": "page",
    "href": "security/jwt.html",
    "desc": "三段 Base64 结构解析、HMAC-SHA256 签名验证流程和 alg:none 安全漏洞说明。",
    "kind": "protocol",
    "level": "intermediate",
    "presentations": [
      "article",
      "diagram",
      "animation",
      "lab"
    ],
    "interaction": "stepper",
    "learning": {
      "objective": "理解JWT的核心原理、适用场景与工程边界。"
    }
  },
  {
    "id": "sec-pki",
    "label": "PKI 与证书体系",
    "module": "security",
    "type": "page",
    "href": "security/pki.html",
    "desc": "CA 层级签发证书链，浏览器从叶证书向上逐层验证到根 CA，ACME 自动续签，OCSP 吊销检查。",
    "kind": "protocol",
    "level": "intermediate",
    "presentations": [
      "article",
      "diagram",
      "animation",
      "lab"
    ],
    "interaction": "stepper",
    "learning": {
      "objective": "理解PKI 与证书体系的核心原理、适用场景与工程边界。"
    }
  },
  {
    "id": "sec-secrets",
    "label": "密钥管理 Vault",
    "module": "security",
    "type": "page",
    "href": "security/secrets.html",
    "desc": "Vault 动态凭据：服务请求后生成一次性账号（TTL），到期自动销毁，凭据不持久存在，自动轮换消除静态密码。",
    "kind": "protocol",
    "level": "intermediate",
    "presentations": [
      "article",
      "diagram",
      "animation",
      "lab"
    ],
    "interaction": "stepper",
    "learning": {
      "objective": "理解密钥管理 Vault的核心原理、适用场景与工程边界。"
    }
  },
  {
    "id": "sec-container",
    "label": "容器安全",
    "module": "security",
    "type": "page",
    "href": "security/container-security.html",
    "desc": "镜像 CVE 扫描（Trivy），securityContext 限制权限，Seccomp/AppArmor 限制 syscall，K8s RBAC 最小权限原则。",
    "kind": "protocol",
    "level": "intermediate",
    "presentations": [
      "article",
      "code"
    ],
    "interaction": "none",
    "learning": {
      "objective": "理解容器安全的核心原理、适用场景与工程边界。"
    }
  },
  {
    "id": "sec-supply-chain",
    "label": "供应链安全",
    "module": "security",
    "type": "page",
    "href": "security/supply-chain.html",
    "desc": "SBOM 软件物料清单，Cosign 对镜像摘要签名，K8s Admission Webhook 强制验签，防止构建链污染。",
    "kind": "protocol",
    "level": "intermediate",
    "presentations": [
      "article",
      "code"
    ],
    "interaction": "none",
    "learning": {
      "objective": "理解供应链安全的核心原理、适用场景与工程边界。"
    }
  },
  {
    "id": "sec-zero-trust",
    "label": "零信任网络",
    "module": "security",
    "type": "page",
    "href": "security/zero-trust.html",
    "desc": "Never Trust Always Verify：每次访问经过身份认证+设备健康检查+最小权限授权，mTLS 服务间双向验证。",
    "kind": "protocol",
    "level": "intermediate",
    "presentations": [
      "article",
      "diagram",
      "animation",
      "lab"
    ],
    "interaction": "stepper",
    "learning": {
      "objective": "理解零信任网络的核心原理、适用场景与工程边界。"
    }
  }
]
