[
  {
    "id": "kafka",
    "label": "Kafka",
    "module": "kafka",
    "type": "module",
    "href": "kafka/index.html",
    "desc": "Producer、Consumer、分区副本、消费者组和现代 KRaft 方向。"
  },
  {
    "id": "kafka-overview",
    "label": "Kafka 存储模型",
    "module": "kafka",
    "type": "page",
    "href": "kafka/kafka-overview.html",
    "desc": "Topic、Partition、Segment、Offset、顺序写和 Page Cache 构成 Kafka 高吞吐基础。",
    "kind": "mechanism",
    "level": "intermediate",
    "presentations": [
      "article",
      "animation",
      "code"
    ],
    "interaction": "stepper",
    "learning": {
      "objective": "理解Kafka 存储模型的核心原理、适用场景与工程边界。"
    }
  },
  {
    "id": "kafka-producer",
    "label": "Kafka Producer",
    "module": "kafka",
    "type": "page",
    "href": "kafka/producer.html",
    "desc": "Batch、linger.ms、acks、min.insync.replicas、幂等性和吞吐延迟权衡。",
    "kind": "mechanism",
    "level": "intermediate",
    "presentations": [
      "article",
      "animation",
      "code"
    ],
    "interaction": "stepper",
    "learning": {
      "objective": "理解Kafka Producer的核心原理、适用场景与工程边界。"
    }
  },
  {
    "id": "kafka-consumer",
    "label": "Kafka Consumer",
    "module": "kafka",
    "type": "page",
    "href": "kafka/consumer.html",
    "desc": "Offset、提交语义、消费组和 Exactly Once 边界。",
    "kind": "mechanism",
    "level": "intermediate",
    "presentations": [
      "article",
      "animation",
      "code"
    ],
    "interaction": "stepper",
    "learning": {
      "objective": "理解Kafka Consumer的核心原理、适用场景与工程边界。"
    }
  },
  {
    "id": "kafka-replica",
    "label": "Partition / ISR",
    "module": "kafka",
    "type": "page",
    "href": "kafka/partition-replication.html",
    "desc": "分区、副本、ISR、Leader 选举与高可用。",
    "kind": "mechanism",
    "level": "intermediate",
    "presentations": [
      "article",
      "animation",
      "code"
    ],
    "interaction": "stepper",
    "learning": {
      "objective": "理解Partition / ISR的核心原理、适用场景与工程边界。"
    }
  },
  {
    "id": "kafka-group",
    "label": "Consumer Group",
    "module": "kafka",
    "type": "page",
    "href": "kafka/consumer-group.html",
    "desc": "Rebalance、分区分配和消费扩展。",
    "kind": "mechanism",
    "level": "intermediate",
    "presentations": [
      "article",
      "animation",
      "code"
    ],
    "interaction": "stepper",
    "learning": {
      "objective": "理解Consumer Group的核心原理、适用场景与工程边界。"
    }
  },
  {
    "id": "kraft",
    "label": "KRaft",
    "module": "kafka",
    "type": "page",
    "href": "kafka/kraft.html",
    "desc": "Kafka 元数据管理的新模式，逐步替代 ZooKeeper。",
    "kind": "mechanism",
    "level": "intermediate",
    "presentations": [
      "article",
      "diagram",
      "animation",
      "lab"
    ],
    "interaction": "stepper",
    "learning": {
      "objective": "理解KRaft的核心原理、适用场景与工程边界。"
    }
  },
  {
    "id": "exactly-once",
    "label": "Exactly Once",
    "module": "kafka",
    "type": "page",
    "href": "kafka/exactly-once.html",
    "desc": "幂等 Producer、事务和 offset 原子提交组合出的端到端处理语义。",
    "kind": "mechanism",
    "level": "intermediate",
    "presentations": [
      "article",
      "diagram",
      "animation",
      "lab"
    ],
    "interaction": "stepper",
    "learning": {
      "objective": "理解Exactly Once的核心原理、适用场景与工程边界。"
    }
  }
]
