[
  {
    "id": "linux",
    "label": "Linux",
    "module": "linux",
    "type": "module",
    "href": "linux/index.html",
    "desc": "命令、进程、内存、I/O、文件系统和调度器。"
  },
  {
    "id": "epoll",
    "label": "epoll / I/O 多路复用",
    "module": "linux",
    "type": "page",
    "href": "linux/io-models.html",
    "desc": "高并发服务器和 Redis 单线程事件循环的系统基础。",
    "kind": "mechanism",
    "level": "intermediate",
    "presentations": [
      "article",
      "diagram",
      "animation",
      "code",
      "lab"
    ],
    "interaction": "stepper",
    "learning": {
      "objective": "理解epoll / I/O 多路复用的核心原理、适用场景与工程边界。"
    }
  },
  {
    "id": "vm",
    "label": "虚拟内存 / mmap",
    "module": "linux",
    "type": "page",
    "href": "linux/virtual-memory.html",
    "desc": "页表、TLB、缺页异常、mmap 与数据库页缓存有关。",
    "kind": "mechanism",
    "level": "intermediate",
    "presentations": [
      "article",
      "diagram",
      "animation",
      "code",
      "lab"
    ],
    "interaction": "stepper",
    "learning": {
      "objective": "理解虚拟内存 / mmap的核心原理、适用场景与工程边界。"
    }
  },
  {
    "id": "fs",
    "label": "VFS / inode",
    "module": "linux",
    "type": "page",
    "href": "linux/filesystem.html",
    "desc": "文件系统抽象，和 WAL、日志文件、零拷贝链路相关。",
    "kind": "mechanism",
    "level": "intermediate",
    "presentations": [
      "article",
      "diagram",
      "animation",
      "code",
      "lab"
    ],
    "interaction": "stepper",
    "learning": {
      "objective": "理解VFS / inode的核心原理、适用场景与工程边界。"
    }
  },
  {
    "id": "sched",
    "label": "CFS / EEVDF",
    "module": "linux",
    "type": "page",
    "href": "linux/scheduling.html",
    "desc": "CFS/EEVDF 调度、公平性、权重与 vruntime 增长关系。",
    "kind": "mechanism",
    "level": "intermediate",
    "presentations": [
      "article",
      "diagram",
      "animation",
      "code",
      "lab"
    ],
    "interaction": "stepper",
    "learning": {
      "objective": "理解CFS / EEVDF的核心原理、适用场景与工程边界。"
    }
  },
  {
    "id": "linux-commands",
    "label": "Linux 常用命令",
    "module": "linux",
    "type": "page",
    "href": "linux/commands.html",
    "desc": "ps、ss、df、du、curl、grep 等命令连接进程、网络、磁盘和日志排障。",
    "kind": "practice",
    "level": "intermediate",
    "presentations": [
      "article",
      "diagram",
      "animation",
      "code",
      "lab"
    ],
    "interaction": "stepper",
    "learning": {
      "objective": "理解Linux 常用命令的核心原理、适用场景与工程边界。"
    }
  },
  {
    "id": "linux-process",
    "label": "进程生命周期",
    "module": "linux",
    "type": "page",
    "href": "linux/process-lifecycle.html",
    "desc": "进程创建、运行、阻塞、退出和回收的生命周期。",
    "kind": "mechanism",
    "level": "intermediate",
    "presentations": [
      "article",
      "diagram",
      "animation",
      "code",
      "lab"
    ],
    "interaction": "stepper",
    "learning": {
      "objective": "理解进程生命周期的核心原理、适用场景与工程边界。"
    }
  },
  {
    "id": "sequential-io",
    "label": "顺序写 / Page Cache",
    "module": "linux",
    "type": "page",
    "href": "linux/sequential-io.html",
    "desc": "Kafka、WAL、LSM 都依赖顺序写、批量刷盘和 Linux Page Cache 提升吞吐。",
    "kind": "mechanism",
    "level": "intermediate",
    "presentations": [
      "article",
      "code"
    ],
    "interaction": "none",
    "learning": {
      "objective": "理解顺序写 / Page Cache的核心原理、适用场景与工程边界。"
    }
  },
  {
    "id": "zero-copy",
    "label": "零拷贝",
    "module": "linux",
    "type": "page",
    "href": "linux/zero-copy.html",
    "desc": "sendfile / mmap 减少内核态与用户态数据拷贝，是 Kafka 高吞吐和 HTTP 文件服务的核心优化。",
    "kind": "mechanism",
    "level": "intermediate",
    "presentations": [
      "article",
      "code"
    ],
    "interaction": "none",
    "learning": {
      "objective": "理解零拷贝的核心原理、适用场景与工程边界。"
    }
  },
  {
    "id": "ebpf",
    "label": "eBPF",
    "module": "linux",
    "type": "page",
    "href": "linux/ebpf.html",
    "desc": "现代 Linux 可观测、网络和安全能力，包括多生产者单消费者 BPF ring buffer。",
    "kind": "mechanism",
    "level": "intermediate",
    "presentations": [
      "article",
      "code"
    ],
    "interaction": "none",
    "learning": {
      "objective": "理解eBPF的核心原理、适用场景与工程边界。"
    }
  },
  {
    "id": "cgroup",
    "label": "cgroup / Namespace",
    "module": "linux",
    "type": "page",
    "href": "linux/cgroup.html",
    "desc": "容器资源限制和隔离的系统基础。",
    "kind": "mechanism",
    "level": "intermediate",
    "presentations": [
      "article",
      "code"
    ],
    "interaction": "none",
    "learning": {
      "objective": "理解cgroup / Namespace的核心原理、适用场景与工程边界。"
    }
  },
  {
    "id": "linux-ipc",
    "label": "进程间通信 / IPC",
    "module": "linux",
    "type": "page",
    "href": "linux/ipc.html",
    "desc": "管道可配置容量、共享内存、消息队列和信号量的语义与性能权衡。",
    "kind": "mechanism",
    "level": "intermediate",
    "presentations": [
      "article",
      "diagram",
      "animation",
      "lab"
    ],
    "interaction": "stepper",
    "learning": {
      "objective": "理解进程间通信 / IPC的核心原理、适用场景与工程边界。"
    }
  },
  {
    "id": "linux-signal",
    "label": "信号 / Signal",
    "module": "linux",
    "type": "page",
    "href": "linux/signal.html",
    "desc": "信号产生→传递→处理、wait 状态、shell 退出状态与受系统策略约束的 core dump。",
    "kind": "mechanism",
    "level": "intermediate",
    "presentations": [
      "article",
      "diagram",
      "animation",
      "code",
      "lab"
    ],
    "interaction": "stepper",
    "learning": {
      "objective": "理解信号 / Signal的核心原理、适用场景与工程边界。"
    }
  },
  {
    "id": "linux-netstack",
    "label": "Linux 网络协议栈",
    "module": "linux",
    "type": "page",
    "href": "linux/network-stack.html",
    "desc": "socket→TCP→IP→Netfilter→网卡 DMA 的完整收发包路径，是网络调优和 eBPF 的基础。",
    "kind": "mechanism",
    "level": "intermediate",
    "presentations": [
      "article",
      "diagram",
      "animation",
      "lab"
    ],
    "interaction": "stepper",
    "learning": {
      "objective": "理解Linux 网络协议栈的核心原理、适用场景与工程边界。"
    }
  },
  {
    "id": "linux-container",
    "label": "容器原理",
    "module": "linux",
    "type": "page",
    "href": "linux/container.html",
    "desc": "Namespace+Cgroup+OverlayFS 三层组合实现隔离，容器不是虚拟机。",
    "kind": "mechanism",
    "level": "intermediate",
    "presentations": [
      "article",
      "diagram",
      "animation",
      "lab"
    ],
    "interaction": "stepper",
    "learning": {
      "objective": "理解容器原理的核心原理、适用场景与工程边界。"
    }
  },
  {
    "id": "linux-perf",
    "label": "性能工具",
    "module": "linux",
    "type": "page",
    "href": "linux/perf-tools.html",
    "desc": "USE 方法论指导 perf/eBPF/bpftrace 系统性定位 CPU/内存/IO 瓶颈。",
    "kind": "mechanism",
    "level": "intermediate",
    "presentations": [
      "article"
    ],
    "interaction": "none",
    "learning": {
      "objective": "理解性能工具的核心原理、适用场景与工程边界。"
    }
  },
  {
    "id": "linux-systemd",
    "label": "Systemd",
    "module": "linux",
    "type": "page",
    "href": "linux/systemd.html",
    "desc": "PID 1 服务管理、Unit 依赖图、socket activation 和 cgroup 集成。",
    "kind": "mechanism",
    "level": "intermediate",
    "presentations": [
      "article"
    ],
    "interaction": "none",
    "learning": {
      "objective": "理解Systemd的核心原理、适用场景与工程边界。"
    }
  },
  {
    "id": "linux-io-uring",
    "label": "io_uring",
    "module": "linux",
    "type": "page",
    "href": "linux/io-uring.html",
    "desc": "SQ/CQ 环形队列批量提交 I/O，一次系统调用处理多个请求，减少用户态/内核态切换，零拷贝固定缓冲区。",
    "kind": "mechanism",
    "level": "intermediate",
    "presentations": [
      "article",
      "diagram",
      "animation",
      "lab"
    ],
    "interaction": "stepper",
    "learning": {
      "objective": "理解io_uring的核心原理、适用场景与工程边界。"
    }
  },
  {
    "id": "linux-dpdk",
    "label": "DPDK 用户态网络",
    "module": "linux",
    "type": "page",
    "href": "linux/dpdk.html",
    "desc": "PMD 轮询模式绕过内核中断，大页内存减少 TLB miss，用户态直接读写网卡 DMA，千万 pps 级高性能网络处理。",
    "kind": "mechanism",
    "level": "intermediate",
    "presentations": [
      "article",
      "code"
    ],
    "interaction": "none",
    "learning": {
      "objective": "理解DPDK 用户态网络的核心原理、适用场景与工程边界。"
    }
  }
]
